{
  "schema_version": "1",
  "upstream_repo": "serpro69/claude-toolbox",
  "template_version": "v1.0.0",
  "synced_at": "2025-01-27T10:00:00Z",
  "variables": {
    "PROJECT_NAME": "my-project",
    "LANGUAGES": "typescript",
    "CC_MODEL": "sonnet",
    "CC_EFFORT_LEVEL": "high",
    "SERENA_INITIAL_PROMPT": ""
  }
}
